{
  "manifest_version": "1.0.0",
  "repository": "https://github.com/QuadRos-MBCET/safead-dataset-hub",
  "description": "SafeAd AI / SAFE-VISION approved age-categorized social media images and reels catalog",
  "generated_at": "2026-10-21T14:30:00Z",
  "policy_contract": {
    "under_14": [
      "SAFE_FOR_ALL"
    ],
    "age_14_to_17": [
      "SAFE_FOR_ALL",
      "SAFE_14_PLUS"
    ],
    "age_18_plus": [
      "SAFE_FOR_ALL",
      "SAFE_14_PLUS",
      "SAFE_18_PLUS"
    ],
    "prohibited": [
      "UNSAFE_FOR_ALL"
    ]
  },
  "total_items": 200,
  "counts_by_category": {
    "SAFE_FOR_ALL": 100,
    "SAFE_14_PLUS": 100,
    "SAFE_18_PLUS": 0
  },
  "counts_by_type": {
    "image": 150,
    "reel": 50
  },
  "content_items": [
    {
      "content_id": "SAFEAD_SFA_IMG_001",
      "content_type": "image",
      "age_category": "SAFE_FOR_ALL",
      "minimum_age": 0,
      "title": "Everyday Consumer & Home Photo #01",
      "caption": "Wholesome everyday product, gadget, grocery, school, or domestic photo. Universal audience.",
      "media_path": "custom_ads/safe_ad_for_all/images/SAFEAD_SFA_IMG_001.jpg",
      "moderation_status": "APPROVED",
      "source_name": "Wikimedia Commons Open Photography",
      "source_url": "https://commons.wikimedia.org/",
      "license_status": "CC / Public Domain",
      "sha256": "1e69242b50f8b47dc8f74695ef4106c2fab46b5a4680a1aba34496994d67a128",
      "file_size_kb": 66.3,
      "resolution": "221x350"
    },
    {
      "content_id": "SAFEAD_SFA_IMG_002",
      "content_type": "image",
      "age_category": "SAFE_FOR_ALL",
      "minimum_age": 0,
      "title": "Everyday Consumer & Home Photo #02",
      "caption": "Wholesome everyday product, gadget, grocery, school, or domestic photo. Universal audience.",
      "media_path": "custom_ads/safe_ad_for_all/images/SAFEAD_SFA_IMG_002.jpg",
      "moderation_status": "APPROVED",
      "source_name": "Wikimedia Commons Open Photography",
      "source_url": "https://commons.wikimedia.org/",
      "license_status": "CC / Public Domain",
      "sha256": "32d46f3f887b57b2c71674584d63fa4bc3aa5ada739cd0d4d8ba466a58f417fe",
      "file_size_kb": 1095.7,
      "resolution": "3024x2697"
    },
    {
      "content_id": "SAFEAD_SFA_IMG_003",
      "content_type": "image",
      "age_category": "SAFE_FOR_ALL",
      "minimum_age": 0,
      "title": "Everyday Consumer & Home Photo #03",
      "caption": "Wholesome everyday product, gadget, grocery, school, or domestic photo. Universal audience.",
      "media_path": "custom_ads/safe_ad_for_all/images/SAFEAD_SFA_IMG_003.jpg",
      "moderation_status": "APPROVED",
      "source_name": "Wikimedia Commons Open Photography",
      "source_url": "https://commons.wikimedia.org/",
      "license_status": "CC / Public Domain",
      "sha256": "90d28ec5cd2456f8c2f57802bdcd1827cf14d3616c997084e7b41d1d7948c314",
      "file_size_kb": 13205.3,
      "resolution": "6016x4016"
    },
    {
      "content_id": "SAFEAD_SFA_IMG_004",
      "content_type": "image",
      "age_category": "SAFE_FOR_ALL",
      "minimum_age": 0,
      "title": "Everyday Consumer & Home Photo #04",
      "caption": "Wholesome everyday product, gadget, grocery, school, or domestic photo. Universal audience.",
      "media_path": "custom_ads/safe_ad_for_all/images/SAFEAD_SFA_IMG_004.jpg",
      "moderation_status": "APPROVED",
      "source_name": "Wikimedia Commons Open Photography",
      "source_url": "https://commons.wikimedia.org/",
      "license_status": "CC / Public Domain",
      "sha256": "ff9436c70dc366c7b1d828fdb32d4e8a5c58bf38009dc680cf0c75bd42b93b37",
      "file_size_kb": 5429.7,
      "resolution": "3300x4395"
    },
    {
      "content_id": "SAFEAD_SFA_IMG_005",
      "content_type": "image",
      "age_category": "SAFE_FOR_ALL",
      "minimum_age": 0,
      "title": "Everyday Consumer & Home Photo #05",
      "caption": "Wholesome everyday product, gadget, grocery, school, or domestic photo. Universal audience.",
      "media_path": "custom_ads/safe_ad_for_all/images/SAFEAD_SFA_IMG_005.jpg",
      "moderation_status": "APPROVED",
      "source_name": "Wikimedia Commons Open Photography",
      "source_url": "https://commons.wikimedia.org/",
      "license_status": "CC / Public Domain",
      "sha256": "eb1de7981b76eb29a6d74588572b24b7733aaa57b4c528715142528bd6620421",
      "file_size_kb": 8835.1,
      "resolution": "6400x3598"
    },
    {
      "content_id": "SAFEAD_SFA_IMG_006",
      "content_type": "image",
      "age_category": "SAFE_FOR_ALL",
      "minimum_age": 0,
      "title": "Everyday Consumer & Home Photo #06",
      "caption": "Wholesome everyday product, gadget, grocery, school, or domestic photo. Universal audience.",
      "media_path": "custom_ads/safe_ad_for_all/images/SAFEAD_SFA_IMG_006.jpg",
      "moderation_status": "APPROVED",
      "source_name": "Wikimedia Commons Open Photography",
      "source_url": "https://commons.wikimedia.org/",
      "license_status": "CC / Public Domain",
      "sha256": "05b66471a3b6d3662fd3dc505540fa417b5f4f405e9e7267a8443b094f68ba11",
      "file_size_kb": 10908.8,
      "resolution": "4016x6016"
    },
    {
      "content_id": "SAFEAD_SFA_IMG_007",
      "content_type": "image",
      "age_category": "SAFE_FOR_ALL",
      "minimum_age": 0,
      "title": "Everyday Consumer & Home Photo #07",
      "caption": "Wholesome everyday product, gadget, grocery, school, or domestic photo. Universal audience.",
      "media_path": "custom_ads/safe_ad_for_all/images/SAFEAD_SFA_IMG_007.jpg",
      "moderation_status": "APPROVED",
      "source_name": "Wikimedia Commons Open Photography",
      "source_url": "https://commons.wikimedia.org/",
      "license_status": "CC / Public Domain",
      "sha256": "b401fd76e995c138a54724e73539c10f85f8a9221d0433ac1a1843c26ea7d0bd",
      "file_size_kb": 1633.4,
      "resolution": "2304x1712"
    },
    {
      "content_id": "SAFEAD_SFA_IMG_008",
      "content_type": "image",
      "age_category": "SAFE_FOR_ALL",
      "minimum_age": 0,
      "title": "Everyday Consumer & Home Photo #08",
      "caption": "Wholesome everyday product, gadget, grocery, school, or domestic photo. Universal audience.",
      "media_path": "custom_ads/safe_ad_for_all/images/SAFEAD_SFA_IMG_008.jpg",
      "moderation_status": "APPROVED",
      "source_name": "Wikimedia Commons Open Photography",
      "source_url": "https://commons.wikimedia.org/",
      "license_status": "CC / Public Domain",
      "sha256": "66fec5dad28f69690c8c371e6626222b81cd11b4a377c728edf87f190809bbcf",
      "file_size_kb": 2242.4,
      "resolution": "5000x3503"
    },
    {
      "content_id": "SAFEAD_SFA_IMG_009",
      "content_type": "image",
      "age_category": "SAFE_FOR_ALL",
      "minimum_age": 0,
      "title": "Everyday Consumer & Home Photo #09",
      "caption": "Wholesome everyday product, gadget, grocery, school, or domestic photo. Universal audience.",
      "media_path": "custom_ads/safe_ad_for_all/images/SAFEAD_SFA_IMG_009.jpg",
      "moderation_status": "APPROVED",
      "source_name": "Wikimedia Commons Open Photography",
      "source_url": "https://commons.wikimedia.org/",
      "license_status": "CC / Public Domain",
      "sha256": "29a05eec987125cb7b4187f3432ae7481a7783d0d3a692e6f6c1e08195d6021f",
      "file_size_kb": 82.9,
      "resolution": "1080x1080"
    },
    {
      "content_id": "SAFEAD_SFA_IMG_010",
      "content_type": "image",
      "age_category": "SAFE_FOR_ALL",
      "minimum_age": 0,
      "title": "Everyday Consumer & Home Photo #10",
      "caption": "Wholesome everyday product, gadget, grocery, school, or domestic photo. Universal audience.",
      "media_path": "custom_ads/safe_ad_for_all/images/SAFEAD_SFA_IMG_010.jpg",
      "moderation_status": "APPROVED",
      "source_name": "Wikimedia Commons Open Photography",
      "source_url": "https://commons.wikimedia.org/",
      "license_status": "CC / Public Domain",
      "sha256": "5d09c5309421cd03ae565f5af60bc1e76b071c2575266911a9a1c152b2eff416",
      "file_size_kb": 28.8,
      "resolution": "638x296"
    },
    {
      "content_id": "SAFEAD_SFA_IMG_011",
      "content_type": "image",
      "age_category": "SAFE_FOR_ALL",
      "minimum_age": 0,
      "title": "Everyday Consumer & Home Photo #11",
      "caption": "Wholesome everyday product, gadget, grocery, school, or domestic photo. Universal audience.",
      "media_path": "custom_ads/safe_ad_for_all/images/SAFEAD_SFA_IMG_011.jpg",
      "moderation_status": "APPROVED",
      "source_name": "Wikimedia Commons Open Photography",
      "source_url": "https://commons.wikimedia.org/",
      "license_status": "CC / Public Domain",
      "sha256": "8c20003483a17bfa6b977fc28d2603ab7fb2771bdfd76f5c4b5d5cad81e10656",
      "file_size_kb": 834.8,
      "resolution": "4032x3024"
    },
    {
      "content_id": "SAFEAD_SFA_IMG_012",
      "content_type": "image",
      "age_category": "SAFE_FOR_ALL",
      "minimum_age": 0,
      "title": "Everyday Consumer & Home Photo #12",
      "caption": "Wholesome everyday product, gadget, grocery, school, or domestic photo. Universal audience.",
      "media_path": "custom_ads/safe_ad_for_all/images/SAFEAD_SFA_IMG_012.jpg",
      "moderation_status": "APPROVED",
      "source_name": "Wikimedia Commons Open Photography",
      "source_url": "https://commons.wikimedia.org/",
      "license_status": "CC / Public Domain",
      "sha256": "bfdb04a355db81f53299b3c756e5736d0d52d6b25995b3018f9cc287d17b59e3",
      "file_size_kb": 809.9,
      "resolution": "4598x5375"
    },
    {
      "content_id": "SAFEAD_SFA_IMG_013",
      "content_type": "image",
      "age_category": "SAFE_FOR_ALL",
      "minimum_age": 0,
      "title": "Everyday Consumer & Home Photo #13",
      "caption": "Wholesome everyday product, gadget, grocery, school, or domestic photo. Universal audience.",
      "media_path": "custom_ads/safe_ad_for_all/images/SAFEAD_SFA_IMG_013.jpg",